{
  "schemaVersion": "1.0",
  "containerType": "canonical-evidence",
  "exportId": "canonical-synthetic-run-12000",
  "createdAt": "1970-01-01T00:00:12.000Z",
  "exportMode": "canonical-evidence",
  "run": {
    "snapshotCompleteness": "incomplete",
    "runCompleteness": "unknown",
    "runLifecycleStatus": "unknown",
    "expectedModels": [],
    "observedModels": [
      "GPT"
    ],
    "terminalModels": [],
    "pendingModels": [],
    "exportedDuringActiveRun": false,
    "modelStates": {
      "GPT": {
        "observedState": "answer_observed_without_terminal",
        "terminal": false,
        "terminalStatus": null,
        "observedGeneration": "quiescent",
        "latestObservedTextLength": 120,
        "consistencyIssues": []
      }
    }
  },
  "sharedConfig": {
    "runtimeRunConfig": {},
    "runtimeRunConfigEventId": null,
    "extensionVersion": "2.81.169",
    "generatorVersion": "proof-export@2.7.0",
    "reportVersion": "3.6.0",
    "policyIdentity": {
      "policyId": "proof-default-v2",
      "automaticMinimumEvidenceTier": 3,
      "thresholds": {
        "generationStartTimeoutMs": 15000,
        "minimumExtractionCoveragePct": 98,
        "postTerminalGrowthTolerancePct": 0.5,
        "lateEndPolicyToleranceMs": 1000,
        "automaticMinimumEvidenceTier": 3,
        "maximumSignalSkewMs": 250
      }
    },
    "sourceCompatibility": {
      "mode": "native-runtime-ledger",
      "canonicalRuntimeEmissionPending": false,
      "limitations": []
    }
  },
  "dependencyRegistry": {
    "registryVersion": "6.7.0",
    "eventInventoryVersion": "1.0.0",
    "eventRegistry": {
      "ANSWER_CARD_RENDER_EVALUATED": {
        "eventType": "ANSWER_CARD_RENDER_EVALUATED",
        "contractVersion": "1.0.0",
        "layer": "fact",
        "producers": [
          "runtime-observer",
          "legacy-telemetry-adapter"
        ],
        "requiredEnvelopeFields": [
          "schemaVersion",
          "eventId",
          "eventType",
          "layer",
          "seq",
          "wallTs",
          "runSessionId",
          "producer",
          "payload"
        ],
        "identity": {
          "modelScoped": true,
          "requiredFields": [
            "runSessionId",
            "modelId"
          ],
          "incidentDiscriminatorFields": [
            "dispatchId",
            "generationEpoch",
            "documentInstanceId",
            "navigationEpoch"
          ]
        },
        "recipients": [
          "proof-ledger",
          "all-presets-json",
          "standalone-report",
          "canonical-evidence"
        ],
        "sampling": {
          "mode": "none",
          "lossPolicy": "lossless"
        },
        "retention": {
          "criticality": "critical",
          "canonical": "lossless",
          "legacyParallelStream": "runtime-dependent"
        },
        "consumers": [
          "incident-timeline",
          "model-timeline",
          "telemetry-validator",
          "report:no-delivery"
        ]
      },
      "ANSWER_COMMIT_EVALUATED": {
        "eventType": "ANSWER_COMMIT_EVALUATED",
        "contractVersion": "1.0.0",
        "layer": "fact",
        "producers": [
          "runtime-observer",
          "legacy-telemetry-adapter"
        ],
        "requiredEnvelopeFields": [
          "schemaVersion",
          "eventId",
          "eventType",
          "layer",
          "seq",
          "wallTs",
          "runSessionId",
          "producer",
          "payload"
        ],
        "identity": {
          "modelScoped": true,
          "requiredFields": [
            "runSessionId",
            "modelId"
          ],
          "incidentDiscriminatorFields": [
            "dispatchId",
            "generationEpoch",
            "documentInstanceId",
            "navigationEpoch"
          ]
        },
        "recipients": [
          "proof-ledger",
          "all-presets-json",
          "standalone-report",
          "canonical-evidence"
        ],
        "sampling": {
          "mode": "none",
          "lossPolicy": "lossless"
        },
        "retention": {
          "criticality": "critical",
          "canonical": "lossless",
          "legacyParallelStream": "runtime-dependent"
        },
        "consumers": [
          "incident-timeline",
          "model-timeline",
          "telemetry-validator",
          "report:no-delivery"
        ]
      },
      "ANSWER_COMPLETENESS_EVALUATED": {
        "eventType": "ANSWER_COMPLETENESS_EVALUATED",
        "contractVersion": "1.0.0",
        "layer": "inference",
        "producers": [
          "proof-telemetry-policy",
          "legacy-telemetry-adapter"
        ],
        "requiredEnvelopeFields": [
          "schemaVersion",
          "eventId",
          "eventType",
          "layer",
          "seq",
          "wallTs",
          "runSessionId",
          "producer",
          "payload"
        ],
        "identity": {
          "modelScoped": true,
          "requiredFields": [
            "runSessionId",
            "modelId"
          ],
          "incidentDiscriminatorFields": [
            "dispatchId",
            "generationEpoch",
            "documentInstanceId",
            "navigationEpoch"
          ]
        },
        "recipients": [
          "proof-ledger",
          "all-presets-json",
          "standalone-report",
          "canonical-evidence"
        ],
        "sampling": {
          "mode": "none",
          "lossPolicy": "lossless"
        },
        "retention": {
          "criticality": "required",
          "canonical": "bounded-with-explicit-omission",
          "legacyParallelStream": "not-required"
        },
        "consumers": [
          "incident-timeline",
          "model-timeline",
          "telemetry-validator",
          "report:cutted",
          "report:false-success"
        ]
      },
      "ANSWER_DELIVERY_ACKNOWLEDGED": {
        "eventType": "ANSWER_DELIVERY_ACKNOWLEDGED",
        "contractVersion": "1.0.0",
        "layer": "fact",
        "producers": [
          "runtime-observer",
          "legacy-telemetry-adapter"
        ],
        "requiredEnvelopeFields": [
          "schemaVersion",
          "eventId",
          "eventType",
          "layer",
          "seq",
          "wallTs",
          "runSessionId",
          "producer",
          "payload"
        ],
        "identity": {
          "modelScoped": true,
          "requiredFields": [
            "runSessionId",
            "modelId"
          ],
          "incidentDiscriminatorFields": [
            "dispatchId",
            "generationEpoch",
            "documentInstanceId",
            "navigationEpoch"
          ]
        },
        "recipients": [
          "proof-ledger",
          "all-presets-json",
          "standalone-report",
          "canonical-evidence"
        ],
        "sampling": {
          "mode": "none",
          "lossPolicy": "lossless"
        },
        "retention": {
          "criticality": "critical",
          "canonical": "lossless",
          "legacyParallelStream": "runtime-dependent"
        },
        "consumers": [
          "incident-timeline",
          "model-timeline",
          "telemetry-validator",
          "report:no-delivery"
        ]
      },
      "ANSWER_DELIVERY_REJECTED": {
        "eventType": "ANSWER_DELIVERY_REJECTED",
        "contractVersion": "1.0.0",
        "layer": "fact",
        "producers": [
          "runtime-observer",
          "legacy-telemetry-adapter"
        ],
        "requiredEnvelopeFields": [
          "schemaVersion",
          "eventId",
          "eventType",
          "layer",
          "seq",
          "wallTs",
          "runSessionId",
          "producer",
          "payload"
        ],
        "identity": {
          "modelScoped": true,
          "requiredFields": [
            "runSessionId",
            "modelId"
          ],
          "incidentDiscriminatorFields": [
            "dispatchId",
            "generationEpoch",
            "documentInstanceId",
            "navigationEpoch"
          ]
        },
        "recipients": [
          "proof-ledger",
          "all-presets-json",
          "standalone-report",
          "canonical-evidence"
        ],
        "sampling": {
          "mode": "none",
          "lossPolicy": "lossless"
        },
        "retention": {
          "criticality": "critical",
          "canonical": "lossless",
          "legacyParallelStream": "runtime-dependent"
        },
        "consumers": [
          "incident-timeline",
          "model-timeline",
          "telemetry-validator",
          "report:no-delivery"
        ]
      },
      "ANSWER_SOURCE_MATERIALIZED": {
        "eventType": "ANSWER_SOURCE_MATERIALIZED",
        "contractVersion": "1.0.0",
        "layer": "fact",
        "producers": [
          "runtime-observer",
          "legacy-telemetry-adapter"
        ],
        "requiredEnvelopeFields": [
          "schemaVersion",
          "eventId",
          "eventType",
          "layer",
          "seq",
          "wallTs",
          "runSessionId",
          "producer",
          "payload"
        ],
        "identity": {
          "modelScoped": true,
          "requiredFields": [
            "runSessionId",
            "modelId"
          ],
          "incidentDiscriminatorFields": [
            "dispatchId",
            "generationEpoch",
            "documentInstanceId",
            "navigationEpoch"
          ]
        },
        "recipients": [
          "proof-ledger",
          "all-presets-json",
          "standalone-report",
          "canonical-evidence"
        ],
        "sampling": {
          "mode": "none",
          "lossPolicy": "lossless"
        },
        "retention": {
          "criticality": "critical",
          "canonical": "lossless",
          "legacyParallelStream": "runtime-dependent"
        },
        "consumers": [
          "incident-timeline",
          "model-timeline",